{
  "id": "2115480207469560109",
  "permalink": "https://x.com/github/status/2115480207469560109",
  "author": {
    "name": "GitHub",
    "handle": "@github",
    "profile_url": "https://x.com/github"
  },
  "posted_at": "2026-10-28T16:25:59Z",
  "collected_at": "2026-10-29T16:31:16Z",
  "updated_at": "2026-10-29T16:31:16Z",
  "thread": [
    {
      "id": "2115480273932697764",
      "permalink": "https://x.com/github/status/2115480273932697764",
      "posted_at": "2026-10-28T16:26:15Z",
      "position": 1
    }
  ],
  "summary_md": "**GitHub ([@github](https://x.com/github/status/2115480207469560109))** says **Copilot Fusion Max** scored within two points of Claude Code with Opus 5.5 Max on the Artificial Analysis Coding Agent Index at about half the API cost per task; a self-reply discloses that GitHub commissioned and funded the evaluation and links the methodology.",
  "referenced_urls": [
    {
      "url": "https://docs.github.com/en/copilot/concepts/models/copilot-fusion?utm_source=universe-2026-x&utm_medium=social&utm_campaign=universe-2026",
      "short_url": "https://t.co/c0k5alLKqD",
      "title": "About GitHub Copilot Fusion - GitHub Docs",
      "from_post": "2115480207469560109"
    },
    {
      "url": "https://artificialanalysis.ai/agents/coding-agents",
      "short_url": "https://t.co/OtO1djW4jy",
      "title": "AI Coding Agent Benchmarks & Leaderboard | Artificial Analysis",
      "from_post": "2115480273932697764"
    }
  ],
  "hashtags": [],
  "topics": [
    "harness-dev"
  ],
  "relevance": "Cost/performance data point for coding-agent harness choice (vendor-funded, so read with care).",
  "media": [
    {
      "type": "image",
      "url": "https://pbs.twimg.com/media/HVuyCO2WIAATDlE.jpg",
      "from_post": "2115480207469560109",
      "description": "Artificial Analysis scatter 'Coding Agent Index vs. Cost per Task': GitHub Copilot with Copilot Fusion (max) scores 60 at about $6 per task on the Pareto frontier, versus Claude Code Opus 5.5 (max) at 62 for about $11; Codex, Antigravity, Opencode, Grok Build, DeepSeek Harness and Kimi Code are also plotted.",
      "thumbnail": "posts/2026/10/28/2115480207469560109/media/0.webp",
      "kind": "chart"
    },
    {
      "type": "image",
      "url": "https://pbs.twimg.com/media/HVuyCZMWMAAFNkI.jpg",
      "from_post": "2115480207469560109",
      "description": "Bar chart of the Artificial Analysis Coding Agent Index (FrontierCode v1.1, Terminal-Bench 4.0, SWE-Atlas-QnA-AA): Claude Code Opus 5.5 and Devin Fusion CLI 62, GitHub Copilot Fusion 60, Claude Code Sonnet 5.5 59, Codex GPT-6 Astra 55, down to Kimi Code CLI 41.",
      "thumbnail": "posts/2026/10/28/2115480207469560109/media/1.webp",
      "kind": "chart",
      "ocr_text": "Claude Code (Opus 5.5 max) 62 · Devin Fusion CLI 62 · GitHub Copilot (Copilot Fusion max) 60 · Claude Code (Sonnet 5.5 max) 59 · Codex (GPT-6 Astra max) 55 · Codex (GPT-6.1 Sol max) 54 · Antigravity CLI (Gemini 4 Argon) 53 · Muse Code (Muse Wonder max) 52 · Opencode (GLM-5.3) 49 · Codex (GPT-6.1 Terra xhigh) 48 · Grok Build (Grok 4.7 xhigh) 47 · DeepSeek Harness (DeepSeek V4.1 Flash 1017) 46 · Kimi Code CLI (Kimi K3) 41"
    }
  ]
}
