{
  "id": "2115419888361820607",
  "permalink": "https://x.com/Madaoer_Yxd/status/2115419888361820607",
  "author": {
    "name": "Xindi Yang",
    "handle": "@Madaoer_Yxd",
    "profile_url": "https://x.com/Madaoer_Yxd"
  },
  "posted_at": "2026-10-28T12:26:18Z",
  "collected_at": "2026-10-29T16:31:16Z",
  "updated_at": "2026-10-29T16:31:16Z",
  "thread": [],
  "summary_md": "**Xindi Yang ([@Madaoer_Yxd](https://x.com/Madaoer_Yxd/status/2115419888361820607))** describes **Oneira**, where a coding agent maintains an explicit world state while a video model renders pixels, so interactions persist over long horizons in video world models; the project page has details.",
  "referenced_urls": [
    {
      "url": "https://madaoer.github.io/projects/oneira/",
      "short_url": "https://t.co/DhvJxnZb2j",
      "title": "Oneira: From Open-Ended Generation to Open-World Interaction in Video World Models",
      "from_post": "2115419888361820607"
    }
  ],
  "hashtags": [],
  "topics": [
    "agentic-media",
    "agentic-cognition"
  ],
  "relevance": "Agent-maintained state plus generative rendering: a recipe for persistent interactive worlds.",
  "media": [
    {
      "type": "image",
      "url": "https://pbs.twimg.com/media/HVt7K6ibkAAhJoZ.jpg",
      "from_post": "2115419888361820607",
      "description": "Oneira pipeline figure: an input image with the goal 'Pick up the lower left apple', a coding agent planning actions and writing a world-state table, an engine rendering a coarse conditioning video along a camera path, and a video generation model producing the final segment.",
      "thumbnail": "posts/2026/10/28/2115419888361820607/media/0.webp",
      "kind": "diagram"
    }
  ]
}
