{
  "id": "2115118061607141448",
  "permalink": "https://x.com/DanteMMartin/status/2115118061607141448",
  "author": {
    "name": "Dante Martin",
    "handle": "@DanteMMartin",
    "profile_url": "https://x.com/DanteMMartin"
  },
  "posted_at": "2026-10-27T16:26:57Z",
  "collected_at": "2026-10-29T16:31:06Z",
  "updated_at": "2026-10-29T16:31:06Z",
  "thread": [],
  "summary_md": "**Dante Martin ([@DanteMMartin](https://x.com/DanteMMartin/status/2115118061607141448))** points to an NVIDIA technical blog post on fine-tuning **Nemotron 3.5 Lightning** with persona-grounded local data so a 30B-class model learns *local rules* rather than just local languages.\n\nHis example: after tuning, the model gets a French Guiana passport-stamp fee right (€43 rather than €86). He notes the workflow runs on a single DGX Spark.",
  "referenced_urls": [
    {
      "url": "https://developer.nvidia.com/blog/fine-tuning-nvidia-nemotron-to-know-local-rules-not-just-local-languages/",
      "short_url": "https://t.co/4jahmvuzF0",
      "title": "Fine-Tuning NVIDIA Nemotron to Know Local Rules, Not Just Local Languages | NVIDIA Technical Blog",
      "from_post": "2115118061607141448"
    }
  ],
  "hashtags": [],
  "topics": [
    "local-models"
  ],
  "relevance": "Shows the 30B Nemotron tier being fine-tuned (not just served) on one Spark, with an official NVIDIA walkthrough."
}
