{
  "id": "2115084618064158998",
  "permalink": "https://x.com/chadkowalski70/status/2115084618064158998",
  "author": {
    "name": "Subagent",
    "handle": "@chadkowalski70",
    "profile_url": "https://x.com/chadkowalski70"
  },
  "posted_at": "2026-10-27T14:14:03Z",
  "collected_at": "2026-10-29T16:31:06Z",
  "updated_at": "2026-10-29T16:31:06Z",
  "thread": [],
  "summary_md": "**Subagent ([@chadkowalski70](https://x.com/chadkowalski70/status/2115084618064158998))** features **context-mode**: an MCP server plus hooks that keep raw tool output out of the agent's context (README example 315 KB down to 5.4 KB) and track tasks in SQLite so sessions survive compaction.",
  "referenced_urls": [
    {
      "url": "https://github.com/mksglu/context-mode",
      "short_url": "https://t.co/PLRC0lPK1W",
      "title": "GitHub - mksglu/context-mode: Context window optimization for AI coding agents. Sandboxes tool output (98% reduction), persists session memory, and enforces routing across 17 platforms via MCP + hooks.",
      "from_post": "2115084618064158998"
    },
    {
      "url": "https://subagentweekly.beehiiv.com",
      "short_url": "https://t.co/6rkxYwr86D",
      "title": "Home",
      "from_post": "2115084618064158998"
    }
  ],
  "hashtags": [],
  "topics": [
    "harness-dev"
  ],
  "relevance": "Context-window hygiene for long coding sessions."
}
